[{"activo": "BTCUSDT", "calidad": "validado", "evento_utc": "2026-02-05T00:00:00+00:00", "fuente": "Binance spot BTCUSDT (data-api.binance.vision), copia del repo", "hash_sha256": "36e6d149bbb6a2ed1c0eee78239ed74c16f59c014babd8ad6853a560ee2bc4ef", "identificador": "data/mercado/btc_1d.json#1770249600000", "licencia": "datos públicos de mercado de Binance; uso según sus términos", "nota": "", "publicado_utc": "2026-02-06T00:00:00+00:00", "recibido_utc": null, "tipo": "vela_1d", "utilizable_utc": "2026-02-06T00:00:00+00:00", "valor": {"c": 62909.86, "h": 73341.18, "l": 62345.0, "o": 73165.84, "v": 106298.82899}}, {"activo": "BTCUSDT", "calidad": "validado", "evento_utc": "2026-02-06T00:00:00+00:00", "fuente": "Binance spot BTCUSDT (data-api.binance.vision), copia del repo", "hash_sha256": "36e6d149bbb6a2ed1c0eee78239ed74c16f59c014babd8ad6853a560ee2bc4ef", "identificador": "data/mercado/btc_1d.json#1770336000000", "licencia": "datos públicos de mercado de Binance; uso según sus términos", "nota": "", "publicado_utc": "2026-02-07T00:00:00+00:00", "recibido_utc": null, "tipo": "vela_1d", "utilizable_utc": "2026-02-07T00:00:00+00:00", "valor": {"c": 70580.26, "h": 71751.33, "l": 60000.0, "o": 62909.87, "v": 92539.21531}}, {"activo": "BTCUSDT", "calidad": "validado", "evento_utc": "2026-02-07T00:00:00+00:00", "fuente": "Binance spot BTCUSDT (data-api.binance.vision), copia del repo", "hash_sha256": "36e6d149bbb6a2ed1c0eee78239ed74c16f59c014babd8ad6853a560ee2bc4ef", "identificador": "data/mercado/btc_1d.json#1770422400000", "licencia": "datos públicos de mercado de Binance; uso según sus términos", "nota": "", "publicado_utc": "2026-02-08T00:00:00+00:00", "recibido_utc": null, "tipo": "vela_1d", "utilizable_utc": "2026-02-08T00:00:00+00:00", "valor": {"c": 69289.38, "h": 71690.07, "l": 67300.0, "o": 70580.26, "v": 44255.48036}}, {"activo": "BTCUSDT", "calidad": "validado", "evento_utc": "2026-02-08T00:00:00+00:00", "fuente": "Binance spot BTCUSDT (data-api.binance.vision), copia del repo", "hash_sha256": "36e6d149bbb6a2ed1c0eee78239ed74c16f59c014babd8ad6853a560ee2bc4ef", "identificador": "data/mercado/btc_1d.json#1770508800000", "licencia": "datos públicos de mercado de Binance; uso según sus términos", "nota": "", "publicado_utc": "2026-02-09T00:00:00+00:00", "recibido_utc": null, "tipo": "vela_1d", "utilizable_utc": "2026-02-09T00:00:00+00:00", "valor": {"c": 70330.38, "h": 72271.41, "l": 68888.0, "o": 69289.37, "v": 21420.53168}}, {"activo": "BTCUSDT", "calidad": "validado", "evento_utc": "2026-02-09T00:00:00+00:00", "fuente": "Binance spot BTCUSDT (data-api.binance.vision), copia del repo", "hash_sha256": "36e6d149bbb6a2ed1c0eee78239ed74c16f59c014babd8ad6853a560ee2bc4ef", "identificador": "data/mercado/btc_1d.json#1770595200000", "licencia": "datos públicos de mercado de Binance; uso según sus términos", "nota": "", "publicado_utc": "2026-02-10T00:00:00+00:00", "recibido_utc": null, "tipo": "vela_1d", "utilizable_utc": "2026-02-10T00:00:00+00:00", "valor": {"c": 70138.0, "h": 71453.53, "l": 68308.0, "o": 70330.38, "v": 29152.72842}}, {"activo": "BTCUSDT", "calidad": "validado", "evento_utc": "2026-02-10T00:00:00+00:00", "fuente": "Binance spot BTCUSDT (data-api.binance.vision), copia del repo", "hash_sha256": "36e6d149bbb6a2ed1c0eee78239ed74c16f59c014babd8ad6853a560ee2bc4ef", "identificador": "data/mercado/btc_1d.json#1770681600000", "licencia": "datos públicos de mercado de Binance; uso según sus términos", "nota": "", "publicado_utc": "2026-02-11T00:00:00+00:00", "recibido_utc": null, "tipo": "vela_1d", "utilizable_utc": "2026-02-11T00:00:00+00:00", "valor": {"c": 68841.29, "h": 70527.59, "l": 67800.0, "o": 70138.0, "v": 20373.77072}}, {"activo": "BTCUSDT", "calidad": "validado", "evento_utc": "2026-02-11T00:00:00+00:00", "fuente": "Binance spot BTCUSDT (data-api.binance.vision), copia del repo", "hash_sha256": "36e6d149bbb6a2ed1c0eee78239ed74c16f59c014babd8ad6853a560ee2bc4ef", "identificador": "data/mercado/btc_1d.json#1770768000000", "licencia": "datos públicos de mercado de Binance; uso según sus términos", "nota": "", "publicado_utc": "2026-02-12T00:00:00+00:00", "recibido_utc": null, "tipo": "vela_1d", "utilizable_utc": "2026-02-12T00:00:00+00:00", "valor": {"c": 67082.52, "h": 69292.88, "l": 65756.0, "o": 68841.28, "v": 28718.24602}}, {"activo": "BTCUSDT", "calidad": "validado", "evento_utc": "2026-02-12T00:00:00+00:00", "fuente": "Binance spot BTCUSDT (data-api.binance.vision), copia del repo", "hash_sha256": "36e6d149bbb6a2ed1c0eee78239ed74c16f59c014babd8ad6853a560ee2bc4ef", "identificador": "data/mercado/btc_1d.json#1770854400000", "licencia": "datos públicos de mercado de Binance; uso según sus términos", "nota": "", "publicado_utc": "2026-02-13T00:00:00+00:00", "recibido_utc": null, "tipo": "vela_1d", "utilizable_utc": "2026-02-13T00:00:00+00:00", "valor": {"c": 66272.17, "h": 68410.52, "l": 65118.0, "o": 67082.52, "v": 24271.74283}}, {"activo": "BTCUSDT", "calidad": "validado", "evento_utc": "2026-02-13T00:00:00+00:00", "fuente": "Binance spot BTCUSDT (data-api.binance.vision), copia del repo", "hash_sha256": "36e6d149bbb6a2ed1c0eee78239ed74c16f59c014babd8ad6853a560ee2bc4ef", "identificador": "data/mercado/btc_1d.json#1770940800000", "licencia": "datos públicos de mercado de Binance; uso según sus términos", "nota": "", "publicado_utc": "2026-02-14T00:00:00+00:00", "recibido_utc": null, "tipo": "vela_1d", "utilizable_utc": "2026-02-14T00:00:00+00:00", "valor": {"c": 68853.96, "h": 69482.97, "l": 65872.46, "o": 66272.17, "v": 20244.54955}}, {"activo": "BTCUSDT", "calidad": "validado", "evento_utc": "2026-02-14T00:00:00+00:00", "fuente": "Binance spot BTCUSDT (data-api.binance.vision), copia del repo", "hash_sha256": "36e6d149bbb6a2ed1c0eee78239ed74c16f59c014babd8ad6853a560ee2bc4ef", "identificador": "data/mercado/btc_1d.json#1771027200000", "licencia": "datos públicos de mercado de Binance; uso según sus términos", "nota": "", "publicado_utc": "2026-02-15T00:00:00+00:00", "recibido_utc": null, "tipo": "vela_1d", "utilizable_utc": "2026-02-15T00:00:00+00:00", "valor": {"c": 69822.95, "h": 70560.01, "l": 68730.13, "o": 68853.97, "v": 18114.78393}}, {"activo": "BTCUSDT", "calidad": "validado", "evento_utc": "2026-02-15T00:00:00+00:00", "fuente": "Binance spot BTCUSDT (data-api.binance.vision), copia del repo", "hash_sha256": "36e6d149bbb6a2ed1c0eee78239ed74c16f59c014babd8ad6853a560ee2bc4ef", "identificador": "data/mercado/btc_1d.json#1771113600000", "licencia": "datos públicos de mercado de Binance; uso según sus términos", "nota": "", "publicado_utc": "2026-02-16T00:00:00+00:00", "recibido_utc": null, "tipo": "vela_1d", "utilizable_utc": "2026-02-16T00:00:00+00:00", "valor": {"c": 68832.58, "h": 70983.0, "l": 68000.0, "o": 69822.94, "v": 22290.05208}}, {"activo": "BTCUSDT", "calidad": "validado", "evento_utc": "2026-02-16T00:00:00+00:00", "fuente": "Binance spot BTCUSDT (data-api.binance.vision), copia del repo", "hash_sha256": "36e6d149bbb6a2ed1c0eee78239ed74c16f59c014babd8ad6853a560ee2bc4ef", "identificador": "data/mercado/btc_1d.json#1771200000000", "licencia": "datos públicos de mercado de Binance; uso según sus términos", "nota": "", "publicado_utc": "2026-02-17T00:00:00+00:00", "recibido_utc": null, "tipo": "vela_1d", "utilizable_utc": "2026-02-17T00:00:00+00:00", "valor": {"c": 68892.43, "h": 70126.67, "l": 67294.11, "o": 68832.59, "v": 15515.76534}}, {"activo": "BTCUSDT", "calidad": "validado", "evento_utc": "2026-02-17T00:00:00+00:00", "fuente": "Binance spot BTCUSDT (data-api.binance.vision), copia del repo", "hash_sha256": "36e6d149bbb6a2ed1c0eee78239ed74c16f59c014babd8ad6853a560ee2bc4ef", "identificador": "data/mercado/btc_1d.json#1771286400000", "licencia": "datos públicos de mercado de Binance; uso según sus términos", "nota": "", "publicado_utc": "2026-02-18T00:00:00+00:00", "recibido_utc": null, "tipo": "vela_1d", "utilizable_utc": "2026-02-18T00:00:00+00:00", "valor": {"c": 67503.52, "h": 69241.5, "l": 66621.06, "o": 68892.43, "v": 16489.06921}}, {"activo": "BTCUSDT", "calidad": "validado", "evento_utc": "2026-02-18T00:00:00+00:00", "fuente": "Binance spot BTCUSDT (data-api.binance.vision), copia del repo", "hash_sha256": "36e6d149bbb6a2ed1c0eee78239ed74c16f59c014babd8ad6853a560ee2bc4ef", "identificador": "data/mercado/btc_1d.json#1771372800000", "licencia": "datos públicos de mercado de Binance; uso según sus términos", "nota": "", "publicado_utc": "2026-02-19T00:00:00+00:00", "recibido_utc": null, "tipo": "vela_1d", "utilizable_utc": "2026-02-19T00:00:00+00:00", "valor": {"c": 66461.0, "h": 68476.22, "l": 65870.0, "o": 67503.52, "v": 15492.43839}}, {"activo": "BTCUSDT", "calidad": "validado", "evento_utc": "2026-02-19T00:00:00+00:00", "fuente": "Binance spot BTCUSDT (data-api.binance.vision), copia del repo", "hash_sha256": "36e6d149bbb6a2ed1c0eee78239ed74c16f59c014babd8ad6853a560ee2bc4ef", "identificador": "data/mercado/btc_1d.json#1771459200000", "licencia": "datos públicos de mercado de Binance; uso según sus términos", "nota": "", "publicado_utc": "2026-02-20T00:00:00+00:00", "recibido_utc": null, "tipo": "vela_1d", "utilizable_utc": "2026-02-20T00:00:00+00:00", "valor": {"c": 67003.73, "h": 67320.0, "l": 65631.83, "o": 66461.0, "v": 14542.26988}}, {"activo": "BTCUSDT", "calidad": "validado", "evento_utc": "2026-02-20T00:00:00+00:00", "fuente": "Binance spot BTCUSDT (data-api.binance.vision), copia del repo", "hash_sha256": "36e6d149bbb6a2ed1c0eee78239ed74c16f59c014babd8ad6853a560ee2bc4ef", "identificador": "data/mercado/btc_1d.json#1771545600000", "licencia": "datos públicos de mercado de Binance; uso según sus términos", "nota": "", "publicado_utc": "2026-02-21T00:00:00+00:00", "recibido_utc": null, "tipo": "vela_1d", "utilizable_utc": "2026-02-21T00:00:00+00:00", "valor": {"c": 68020.01, "h": 68318.39, "l": 66280.2, "o": 67003.73, "v": 35351.87091}}, {"activo": "BTCUSDT", "calidad": "validado", "evento_utc": "2026-02-21T00:00:00+00:00", "fuente": "Binance spot BTCUSDT (data-ap